id,date,type,status,priority,digitized,title,contributors,summary
1181023,"Jan 1, 1952",RECORDED,4 - performer,,1,Sound of a city,Tony Schwartz (Sound Recordist),"RXF 4955: Sound of a city (Tony Schwartz, narrator) (0:00) -- thunder & rain (01:20) -- birds (01:39) -- dog barking (01:54) -- church bells (02:10) -- boat docking (horn) (02:32) -- crowd sounds (03:06) -- subway turnstiles (03:26) -- street sounds: truck, traffic, construction, alarm (03:47) -- 42nd street sounds, newsdealer (04:44) -- Union square, flower girl (05:21) -- Lexington Ave. in Harlem, shoeshine stand (05:40) -- 52nd St. nightclub doorman (06:01) -- Subway at 135th Street (06:45) -- Orchard Street vendors (07:18) -- Port Authority bus terminal, P.A. announcement (07:37) -- Music segment: Boat whistle (07:54) -- Henriette, singing in French to her baby, tapping sandals, interview (08:28) -- Rumanian gypsy song, with guitar (09:34) -- Nigerian students, singing on Thanksgiving afternoon (10:02) -- Israel music vocal piano and flute, Town Hall (10:21) -- Spanish family group, with drums, bagpipes, castanets, recorded in Spanish Tavern on 10th avenue (11:15) -- Spanish song with translation about Puerto Rico and NY (11:54) -- Friday night service in Jewish home (13:38) -- Italian saint's day parade band (14:11) -- Storefront church service, Puerto Rican protestants (14:30) -- Joy to the World - Harlem church service, Sunday before Christmas (15:03) -- Fishermen from the Carolinas on NY ship (15:58) -- Spiritual sung by cab driver from Mississippi (16:22) -- Moondog, at 11th Avenue and the river (17:05) -- Children's songs (18:27) -- teenagers drumming, with interview (20:03) -- Pen vendor (21:18) -- Little boy on what he did that day (22:17) -- little girl on stories (22:39) -- plumber's thoughts on music (22:53) -- cab driver's thoughts on traffic problem (23:19) -- doorman and dog (24:09) -- woman talk about cat (24:40) -- narration, with blues guitar (25:43) -- morning sounds outside of Schwartz's apartment (26:15) -- construction (27:08) -- air raid drill (27:37) -- church bells (27:55) -- parade band (28:21) -- street football game (28:46) -- Street gospel group, in Spanish, voices and tambourines (29:16) -- rain (29:39) -- street saxophonist (30:00) -- political speech (30:19) -- cats at night (30:45) -- baby (31:49) -- closing narration, w/blues guitar (32:17) -- WNYC announcement (33:37)."
1181025,,,4 - performer,,1,Sound of my city,Tony Schwartz (Sound Recordist),"RXF 4956: Sound of a city (Tony Schwartz, narrator) (0:00) -- thunder & rain (01:20) -- birds (01:39) -- dog barking (01:54) -- church bells (02:10) -- boat docking (horn) (02:32) -- crowd sounds (03:06) -- subway turnstiles (03:30) -- street sounds: truck, traffic, construction, alarm (03:50) -- 42nd street sounds, newsdealer (04:47) -- Union square, flower girl (05:24) -- Lexington Ave. in Harlem, shoeshine stand (05:43) -- 52nd St. nightclub doorman (06:04) -- Subway at 135th Street (06:50) -- Orchard Street vendors (07:23) -- Port Authority bus terminal, P.A. announcement (07:42) -- Music segment: Boat whistle (08:00) -- Henriette, singing in French to her baby, tapping sandals, interview (08:34) -- Rumanian gypsy song, with guitar (09:40) -- Nigerian students, singing on Thanksgiving afternoon (10:08) -- Israel music vocal piano and flute, Town Hall (10:28) -- Spanish family group, with drums, bagpipes, castanets, recorded in Spanish Tavern on 10th avenue (11:22) -- Spanish song with translation about Puerto Rico and NY (12:00) -- Friday night service in Jewish home (13:56) -- Italian saint's day parade band (14:20) -- Storefront church service, Puerto Rican protestants (14:39) -- Joy to the World - Harlem church service, Sunday before Christmas (15:12) -- Fishermen from the Carolinas on NY ship (16:08) -- Spiritual sung by cab driver from Mississippi (16:32) -- Moondog, at 11th Avenue and the river (17:16) -- Children's songs (18:41) -- teenagers drumming, with interview (20:18) -- Pen vendor (21:40) -- Little boy on what he did that day (22:35) -- little girl on stories (22:56) -- plumber's thoughts on music (23:11) -- cab driver's thoughts on traffic problem (23:38) -- doorman and dog (24:28) -- woman talk about cat (25:00) -- Voices of a city: narration, with blues guitar (26:04) -- morning sounds outside of Schwartz's apartment (26:38) -- construction (27:31) -- air raid drill (28:01) -- church bells (28:20) -- parade band (28:46) -- street football game (29:11) -- Street gospel group, in Spanish, voices and tambourines (29:42) -- rain (30:05) -- street saxophonist (30:27) -- political speech (30:46) -- cats at night (31:13) -- baby (32:22) -- closing narration, w/blues guitar (32:46)."
1181201,,RECORDED,4 - performer,,1,The answering machine ; New York 19,Tony Schwartz (Producer),"RXF 4979: Introduction (Tony Schwartz, narrator) (0:00) -- The answering machine (Tony Schwartz, narrator ; unidentified female announcers, speakers ; unidentified men and women, speakers on answering machine recordings ; (0:35) -- New York 19 (Tony Schwartz, narrator ; unidentified male plumber, speaker ; unidentified male grocer, speaker ; unidentified male insurance salesman, speaker ; unidentified male pen salesman, speaker ; unidentified French woman, singer ; congregation of the Puerto Rican storefront church ; Moondog [Louis Hardin], unidentified percussion ; unidentified Puerto Rican man, speaker [translating record playing on jukebox] ; unidentified children singing clapping song, jump rope rhymes and other game songs ; unidentified teenagers playing various forms of percussion) (8:06) -- closing announcement (14:05)."
1187860,"May 26, 1957",RECORDED,4 - performer,,1,"Pete Seeger: 25th anniversary program, May 26, 1957",Pete Seeger (Performer),"1. I'm sticking to the union (00:01) -- 2. Brother, can you spare a dime -- 3. A union song (12:26) -- 4. We're gonna roll (15:42) -- 5. The union's behind us -- 6. We shall overcome."
1192288,"Jan 1, 1951",RECORDED,4 - performer,,1,B. Richardson poem,Beah Richards (Performer),"RXG 0049: Poem ""White Womanhood"" by a negro woman 6:11 (00:07) -- beginning of a spiritual :03 (06:22)."
1194278,,RECORDED,4 - performer,,1,Swift Eagle,Swift Eagle (Performer),"1. Indian war dancing music, chants, and comments (1:00)[00:00] -- 2. Swift Eagle sings echo song from Grand Canyon (and comments) (2:40)[01:06] -- 3. Indian love song (and comments) (2:00)[04:05] -- 4. Flute (and comments) (2:10)[06:10]."
1203655,,,4 - performer,,1,"Bob Dylan, self-portrait : R-1",,Contents: All the tired horses -- Alberta #1 -- Forgot more than you'll ever know -- Days of 49 -- Eary morning rain -- In search of little Sadie -- Let it be me -- Little Sadie -- Woogie boogie -- -- Belle Isle -- Living the blues -- Like a rolling stone.
1203663,"Jan 1, 1960",RECORDED,4 - performer,,1,Bob Dylan self-portrait : R-2,Bob Dylan (Vocalist/Singer),"Contents: 1. Copper kettle -- 2. Gotta travel on -- 3. Blue moon -- 4. The boxer -- 5. The mighty Quinn (Quinn the Eskimo) -- 6. Take me as I am -- 7. Take a message to Mary -- 8. It hurts me too -- 9. Minstrel boy -- 10. She belongs to me -- 11. Wigwam -- 12. Alberta #2. ""Album of Bob Dylan's music and words""--Accompanying collection documentation."
1335547,"May 1, 1957",RECORDED,4 - performer,,1,"Bob Gibson folksong performance, 1957-05",Bob Gibson (Performer),RXF 9251 Down by the bay (00:00) -- The Squirrel (02:07) -- Cum ba yah (03:54) -- Medley (combination of two songs): Brandy and Abi yo-yo (07:13) -- [Unidentified: Come all ye young fellows] (10:19) -- There's a meetin' here tonight (11:02) -- John Riley (12:15) -- Down by the bay (13:53) -- The Squirrel (16:00) -- Cum ba yah (17:47) -- Medley (combination of two songs): Brandy and Abi yo-yo (21:08) -- [Unidentified: Come all ye young fellows] (24:13) -- There's a meetin' here tonight (24:57) -- John Riley (26:11).
1359756,"Apr 1, 1962",RECORDED,4 - performer,,1,Jimmy Giuffre clarinet performances and composition played by a,Jimmy Giuffre (Performer),"RXF 9942: Jimmy Giuffre plays a jazz clarinet piece with bass and drums from a published recording (00:00) -- Giuffre plays clarinet to the sound of dripping water, April 1962 (04:20) -- Possibly an aircheck in which Giuffre's three-movement piece, Affinity, is performed by a Canadian orchestra; comments included (07:23)."
1359757,"Jan 1, 1956",RECORDED,4 - performer,,1,"Jimmy Giuffre performs ""cool's music,"" late 1950s-early 1960s",Jimmy Giuffre (Performer),"Segments of Jimmy Giuffre improvisation on clarinet: 1. Warm-up segments (1:51)[00:00] -- 2. ""Band 1"" (1:21)[01:56] -- 3. ""Band 2"" (:59)[03:20] -- 4. ""Band 3"" (1:22)[04:24] -- 5. ""Band 4"" (:56)[05:47] -- 6. ""Band 5"" (1:00)[06:47] -- 7. ""Band 6"" (1:00)[07:55] -- 8. ""Band 7"" (1:00)[08:58] -- 9. ""Band 8"" (1:00)[10:06] -- 10. ""Band 9,"" with harmonics, natural overtones, and unorthodox fingerings, and Giuffre's explanations (6:53)[11:11]."
1359758,,,4 - performer,,1,"Jimmy Giuffre jazz clarinet performance with saxophone, trombone,",Jimmy Giuffre (Performer),"1. Wrought of iron (Jimmy Giuffre, composer)(2:43)[00:00] -- 2. Iranic (Jimmy Giuffre, composer) (4:41)[02:46] -- 3. A ring-tail monkey (Jimmy Giuffre, composer) (5:20)[07:30] -- 4. Repeat of a ring-tail monkey (2:33)[10:07] -- 5. Repeat of a ring-tail monkey [12:54]."
1466509,"Jan 1, 1960",COMPILED,4 - performer,,1,Jimmy Giuffre on clarinet for American Airlines St. Louis,Jimmy Giuffre (Performer),"1. Ambient sound of docks (:31) -- 2. Blues-based clarinet improvisation (:29) -- 3. ""March 8th demo 1, 2, 3"" spots for American Airlines Astrojet, including voice-over with ambient sound (:45) and music (:45) -- 4. Ambient sound and music without voice-over (:45) -- 5. Ambient sound and music (:45) -- 6. Ambient sound and music (:45) -- 7. Music (:48) -- 8. ""Take 2,"" clarinet only (:58) -- 9. ""Master"" full spot (:45) -- 10. [Ambient sound and music?] (:45) -- 11. [Ambient sound only?] (:45) -- 12. Dock sounds (1:01) -- 13. [Ambient sound and music?] (:45) -- 14. Boat whistle (:05) -- 15. Boat whistle and other pulley and winch sounds (:22) -- 16. Boat whistle (:03) -- 17. Machinery ambience (:59) -- 18. Clarinet (:15) -- 19. Clarinet (1:05) -- 20. Original clarinet improvisation, takes for this spot (8:28)."
1490125,,,4 - performer,,1,Jimmy Giuffre McCall's presentation,Jimmy Giuffre (Performer),"1. Piano tremolo and crash (:09)[00:00] -- 2. Piano tremolo and crash (:06)[00:11] -- 3. Honky-tonk piano waltz (1:07)[00:20] -- 4. Slow Dixieland jazz combo (2:40)[01:31] -- 5. Medley in various tempos performed on piano, clarinet, and other instruments (4:03)[01:56] -- 6. Plates crashing, then slow guitar, then piano, then other instruments (1:16)[08:22] -- 7. McCall's presentation, consisting of a man and woman speaking about home and family with excerpts of previous tracks in the background (1:15)[09:44] -- 8. Three people making random comments on products (:19)[11:02] -- 9. Honky-tonk music with combo (2:35)[11:30] -- 10. Slow Dixieland music (same as track #4) (1:06)[ 14:08]."
1833429,"Jan 1, 1983",PUBLISHED,4 - performer,,1,Common ground,Richie Havens (Performer),Gay cavalier -- Death at an early age -- Lay ye down boys -- This is the hour -- Stand up -- Dear John -- Moonlight rain -- Leave well enough alone -- Things must change.
2450764,,,4 - performer,,1,Moondog tape T-729,,Moondog playing on 2 East 46th Street (2:53) Rhythm (1:38) -- Rhythm w/lady singing (1:15).
2451795,,,4 - performer,,1,Leadbelly,,"Leadbelly sings and plays the guitar for the song, The Beaugouis (i.e. Bourgeois) town blues (2:52). ."
2451843,,,4 - performer,,1,"Doris Pffer sings & plays guitar, tape T-686",,I am a blind fiddler (Indian famine song) (2:33).
2454622,,,4 - performer,,1,"The sound of the family man, tape V134",,"Beep -- The phrase ""the sound of the family man"" said in different languages -- Clips of these sounds: Childhood ; Story of lesson in the equality of men ; Kids' voices ; Music ; Chorus ; Pen pitchman ; Tongue twisters ; Auctioneer ; Marching band ; Silent night ; Moondog ; Another man done gone ; Lynching of a man ; Football game ; Drinking of the wine ; Here comes the bride ; Laughter ; Baby crying ; Women singing in other languages ; On the mountain ; Yiddish."
1173340,"Mar 12, 1968",BROADCAST,4 - performer?,,1,Opera & the baby,Tony Schwartz (Producer),"RXF 3680: Opera and the baby (Tony Schwartz, narrator ; Reenah Schwartz, speaker and singer ; unidentified man, singer ; unidentified orchestra) (0:00). Depicts the relationship between the conscious and the subconscious through the story of Reenah (named Micaela after a character in the opera Carmen). Many years after composing a lullaby, she discovers the song was influenced by the musical passage in the opera for Don Jose's entrance."
1181341,"Jan 1, 1952",RECORDED,4 - performer?,,1,Jose Fonfiras. Puerto Rican children's songs,Tony Schwartz (Speaker) | Reenah Schwartz (Speaker) | Jose Fon Firas (Vocalist/Singer),"RXF 5006: Song in Spanish (Jose Fonfiras, vocals and guitar) (0:00) -- (Jose Fonfiras, vocals and guitar) (1:25) -- conversation (Jose Fonfiras, Tony Schwartz, unidentified woman, speakers) (3:30) -- (Jose Fonfiras, vocals and guitar) (4:37) -- explanation of song (Jose Fonfiras, speaker) (6:05) Talk, songs, explanations (6:45)."
1466519,"Apr 24, 1964",RECORDED,4 - performer?,,1,"Jimmy Giuffre improvisation, 1964-04-24",Jimmy Giuffre (Performer),"""Meandering flurries of improvisation with lots of space in between""--Accompanying collection documentation."
1175199,"Jan 15, 1961",BROADCAST,4 - performers,,1,Chewing gum songs,Tony Schwartz (Producer) | Aileen Stanley (Vocalist/Singer) | Billy Murray (Vocalist/Singer),"""We hear a popular song from 1961, ""Does Your Chewing Gum Lose Its Flavor?"" History repeats itself, Bill [Billy] Murray and Irene [Aileen] Stanley sing ""I Am Gonna Dance With the Guy That Brung Me"" [I'm Gonna Dance Wit' de Guy Wot Brung Me] a gum chewer's song."" (00:00) --Accompanying collection documentation."
1179059,"Aug 26, 1962",BROADCAST,4 - performers,,1,Sounds from New York. Casa Galicia 1962-07-26,Tony Schwartz (Producer),"""Sounds from New York. ""There are people in the city from almost every country in the world"" - Tony Schwartz. Every year, Spanish people have a festival at ""Casa Galicia."" Members of the talented Malerbas family sing, dance, and play guitar and castanets. A Spanish bagpipe surprises Tony at the performance. A chorus of forty or fifty sings. The Director talks about the chorus, the club, and its members. 15:00""--Accompanying collection documentation."
1193064,"Jan 1, 1946",RECORDED,4 - performers,,1,Washington Square kids,,"RXF 6881: How Long (male vocal and guitar) (00:00) -- Oh Johnny Rabbits (two women unaccompanied) (02:15) -- I Am A Pilgrim and A Stranger (male vocal and guitar) (02:55) -- When I'm Gone (male vocal and banjo with background vocals) (05:03) -- Ringtail Tom (male vocal with banjo and guitar) (06:50) -- Sail Away and comments (male vocals, guitar and banjo and backup vocals) (09:11) -- Deliah's Gone (male vocal with banjo and backup vocals) (10:43) -- In the Evening (male vocal and banjo) (13:45)."
1201370,"Jan 14, 1963",RECORDED,4 - performers,,1,"New York Percussion Trio, 1963-01-14, and edited excerpts of the",Tony Schwartz (Narrator) | Arnold Goldberg (Performer) | New York Percussion Trio (Performer) | Ronald Gould (Performer),"RXF 8841: Drum roll (00:00) -- Sabre Dance (00:12) -- Lecture on playing percussion, with audience clapping in different rhythms ; teaching a child his part in the piece ; ""Skaters' Waltz"" ; information about the timpani ; a sonatina for timpani ; other percussion instruments, and ""Sleighride"" (02:20) -- Unidentified music of piano and percussion (22:07) -- Question-and-answer period for children in audience ; sixteen children chosen to play Latin instruments (""please! please!"") (27:29) -- Instruction on playing the Latin instruments (34:11) -- Tony Schwartz talks to a child (36:37) -- Trio member Arnold Goldberg gives an address (36:54). RXF 8842: Choosing children (""please! please!"") (00:00) -- Variation on segment #1 (00:35) -- Clapping demo (00:52) -- Instrument demos (02:13) -- Q&A on vibraphone (05:05) -- Q&A on kettle drum (05:27) -- Q&A on xylophone (05:39) -- Teaching child to play snare drum (05:59) -- Skaters' Waltz (06:31) -- Sleighride (08:06) -- Singing and clapping an improvised tune (10:07) -- ""What are little boys made of"" with banjo, singer, and children (12:17) -- ""kum bi ya"" with folksinger, banjo, and children (14:22) -- ""Abee-yo-yo"" (18:09). RXF 8843: TS piece on rhythm with a kids school assembly program (includes Trio playing ""Sleighride"") (00:00) -- Tony Schwartz's introduction and narration for the radio program (cold) (10:25)."
1179067,,RECORDED,4 - performers?,,1,African drums,,RXF 4652: African Dance Group Uri-Uri: Singing (00:00) -- Drums (02:38) -- African Dance Group - wooden percussion (02:50) -- African Dance Group - voices and drums (04:43) -- Bini Tribe - Secret Society Drums (5 drums) (05:31) -- Bini Tribe - Secret Society Drums - part II (08:02).
1181255,"Jan 1, 1952",RECORDED,4 - performers?,,1,Dvoka - Eleven songs sung in a foreign language,,RXF 4988: Unidentified song (1:37) [00:00] -- Unidentified song (1:46) [01:41] -- Unidentified song (1:50) [03:32] -- Unidentified song (1:57) [05:26] -- Unidentified song (1:12) [06:24] -- Unidentified song (:58) [07:40] -- Unidentified song (1:18) [08:41] -- Unidentified song (1:25) [10:00] -- Unidentified song (1:53) [11:26] -- Unidentified song (2:55) [12:24] -- Unidentified song (:53) [15:22].
1188061,"Jan 3, 1952",RECORDED,4 - performers?,,1,Pennsylvania Dutch folk festival,Joe Yoder (Speaker),"RXG 0013: Hymn of Praise: translation and demonstration of ""Gregorian Chant"" (00:00) -- Joe Yoder gives his experience with Pow-Wowing (01:37) -- ""Do-La-La-Do"" (03:48) --""Bingo Was His Name Sir"" (04:26) -- ""Chipmunk Song"" - Old Church Style (sung to melody of O Tannenbaum) (05:08) -- ""Wanny-Kum"" (07:20) -- Song sung in a foreign language (08:50) -- Song about what a father will give his daughter if she gets married (09:35) -- Song about the chores associated with each day of the week (10:43) -- ""Daughter Will You Marry"" (13:36) -- ""Over There"" (15:40) -- ""Luddle Lie-Lie"" (17:20) -- ""As I Went Down To Darby"" (19:20) -- ""Spin, Spin, My Darling Daughter"" (20:30)."
1201239,"Jan 1, 1960",RECORDED,4 - performers?,,1,Children- Kids telling incidents,Tony Schwartz (Speaker) | Cathy Roberts (Speaker) | June Hardin (Speaker) | Stephen Daly (Speaker),"Kids singing (excerpts): 驴Bill Grogan驴s Goat驴- the rainbow song- 驴My Country Tis of Thee驴 played painstakingly on guitar (1:30) -- More 驴My Country Tis of Thee驴 w/ interview of child (Denny) guitar playibg -Boy- Steven Daly on Christmas, Christmas morning, training dogs, making cookies, story of a family, a spider, a dog, Christmas tree, scrambled eggs, a moose, a lion (17:32) -- Girl- Becky- Story about a chipmonk and a frog, 4 songs with made- up words -Girl- Cathy Roberts- Story of 驴Goldilocks驴 (2:44) -- Girl- June Hardin- Answers questions, story of 驴Mean goat named Chi Chi and Peter Rabbit (3:31) -- Girl- June Hardin- short unintelligible story (:30) -- P.S. 191 kids- (poor quality) child talks about baby brother, another child talks about his sister losing a tooth (2:17) -- 2 girls and a boy- girl tells story of 驴Goldilocks驴 and 驴Caw, Caw, Caw and a Little Crow驴 talks about pets dying, sings songs (10:05) -- Steven Daly- Story of his black eye (2:10). See paper file for accompanying material."
1833624,,,4 - performers?,,1,"New York 19, Tony Schwartz",Tony Schwartz,"Side A: Why collect recordings -- Exchange by mail -- National groups, visitors, students, concert hall -- Religion -- Translations. Side B: Street musicians -- Selling -- Children -- Sounds of the City -- Music in speech."
1179248,"Feb 28, 1953",RECORDED,"4 - performers? probably some great sounds, though",,1,Amsterdam Boys 1953-02-28,Tony Schwartz (Producer),RXF 4819: Pants rhythms and explanations (00:00) -- Clapping and whistling (01:59) -- Drums (03:12) -- Drums - different rhythms (04:17).
1588527,"Sep 13, 1951",RECORDED,4 - program,,1,"The nation's nightmare, 1951-09-13",Bill Downs (Speaker),CBS program on illegal drugs narrated by Bill Downs for Tony Schwartz. The Nation's Nightmare (00:00).
1833191,"Jan 31, 1989",RECORDED,4 - PSAs,,1,"Center to Prevent Handgun Violence, 5 handgun spots, 1989-01-31",,No summary found.
1180915,"Jun 9, 1991",BROADCAST,4 - radio show,,1,"Sister Camille D'Arienzo, WINS radio, New York, New York, 1991 June 9",Camille D'Arienzo (Speaker),No summary found.
1209453,"Apr 21, 1958",RECORDED,4 - radio show,,1,"Michael Farmer case, 1958-04-21",Edward R. Murrow (Speaker),Segment of the Edward R. Murrow radio show on a youth gang's murder of a 15-year-old in a New York City park.
1667630,"Jan 1, 1995",BROADCAST,4 - WBAI radio broadcast,,1,Radio report about Native American protests of sports team mascots;,"WBAI Radio (New York, N.Y.)","Side one: Consists of a prolonged segment of radio broadcast from WBAI New York. First: report of Native Americans protesting sports team mascots in Houghton, MI; on National Native News. Second: Wake Up Call. Wake Up Call makes mention of the 1995 Million Man March and the O. J. Simpson verdict."
1175478,"Feb 27, 1968",BROADCAST,4 - WNYC show,,1,The sense of sound,Tony Schwartz (Producer) | Bob Landers (Speaker),RXF 4207: TS show from WNYC: Bob Landers talks about sound (00:00).
1178633,"Oct 1, 1967",BROADCAST,4 - WNYC show,,1,Storyline,Marshall McLuhan (Speaker) | Tony Schwartz (Speaker),"""Tony's WNYC show about the demise of story line, with excerpts from McLuhan and examples of ""fade-out"" as song ending in various pop songs. RXF 4749: 1. Various song endings from Frank Sinatra to the Beatles (00:00) -- 2. Marshall McLuhan comments on the loss of story line (01:57) -- 3. WNYC program (02:57) -- 4. Tony Schwartz voice overs for the program (07:34)."
1180905,"Jan 1, 1952",RECORDED,4 - WNYC show,,1,Tiger Haines,Tiger Haines (Performer),"RXF 4940: Wake up WYNC [WNYC?] (00:00) -- Every time it rains (00:28) -- Brownstone blues (01:36) -- Well o well, pretty baby (03:44) -- Oh lawdie (false start & finish) (06:43) --The Man on the hill (09:26) -- Oh Mary gal (10:53) -- I went up in the air (folk tale) (11:34) -- Frankie & Johnny (13:14) -- Masterpiece guitar piece (15:49) -- A woman in the back room (a dirty song by Tom Murray) (17:00)."
1374662,"May 24, 1961",BROADCAST,4 - WNYC show,,1,Jimmy Giuffre with Tony Schwartz on the WNYC radio program Sounds of,Jimmy Giuffre (Performer) | Tony Schwartz (Speaker),"""1. Tony Schwartz hosts radio program which features Jimmy Giuffre playing his clarinet in various 'natural' sound environments which include: a huge office building lobby (with footsteps and reverb), hall (w/reverb), city traffic, 10 o'clock bells in Herald Square, Port Authority with buses. These musical segments are interspersed with commentary by Tony [Schwartz] and Jimmy Giuffre including Jimmy's idea of conducting a musical piece using boat horns in the N.Y.C. [New York City] harbor (16:00)[00:00] -- 2. All the material (inserts) for the above program: a. Tony's narration [15:59] b. Jimmy's music and commentary (17:05)20:31] -- 3. Out-takes: several improvised portions not used in the above radio program (7:39)[33:13]""--Accompanying collection documentation."
1705776,,,5 - possibly unusable audio,,1,Recording test; Tony Schwartz on his early sound work,Tony Schwartz (Speaker),"Side A: Comparison of different recorders. Side B: Tony Schwartz talks to unidentified person about his background with sound. Sound is distorted and skips around, difficult to follow."
1838273,,,5 - possibly unusable audio,,1,Unidentified Tony Schwartz collection cassette,,The recording starts in the middle of an interview and gets cut off.
1196222,,,1,1,0,Air conditioning,Tony Schwartz (Sound Recordist),Various comments on the everyday impact of air-conditioning on our lives (4:45). See paper file for accompanying material.
1200046,,,1,1,0,Animals,Tony Schwartz (Sound Recordist),"*Lots of drop-out and silence at start of reel. -- Rooster -- Bull frog -- -Frogs, toads, rooster, chicken, pigs -- Lion and dog, cows and bulls, dogs, ducks -- Horses running, dog, birds -- Talking bird 驴Hello Laura驴, 驴Goodbye Laura驴 -- Mechanical cow -- Backyard cats. See paper file for accompanying material."
1200116,"Jan 1, 1962",RECORDED,1,1,0,Background sounds in different locations,,"Spanish kids on street, waiting on picnic bus 6-63 -- Lincoln Center Philharmonic Hall lobby 9-62 -- Grand Central station terminal 7-62 -- Tavern on the green 1962 -- Inside Chemical Bank, N.Y. 57th St. 196 -- Stage Deli 1961 -- Grand Central terminal -- N.Y. Central engines -- Building lobby 11 East 36th St.- good -- Hawaiian room- N.Y. dining room sound- Lex Hotel -- Singing at party in BAQ ROOM -- Breakfast sound in luncheonette -- Luncheonette at noon- counter calls and sounds. -- Macy驴s- inside store at Christmas time. -- Inside taxi in snow- windshield wipers. -- Restaurant background. -- Building lobby sounds and feet. -- Inside 57th St. crosstown bus. -- Museum of Modern Art water fountain. -- Main reading room- N.Y. public library. (Total time 44:30). See paper file for accompanying material."
