id,date,type,status,priority,digitized,title,contributors,summary
1200282,"Jan 1, 1967",RECORDED,1,1,0,Boat sounds,,"Reel 1. Various boat whistles, engines, winches, tug boats, ocean liners, moving water, fog horns, the sounds of docking (Total time 34:36). Reel 2. Speedboats and crowds at races (:38) -- Speedboats and crowds at races (:45) -- Water lapping, people chatting, cheers (:45) -- People chatting, woman giggling (:42) -- Cheers and clapping (:10) -- Cheers and clapping, 驴Bravo!驴 (:08). (Total time 3:07). Reel 3. Horns, machine sounds. 15th St. (:30) -- Gulls, quiet engine (1:00) -- Gulls, quiet engine (:46) -- Horns (1:20) -- Dock sounds, horns, engines (17:32) -- Departure of 驴Europa驴 from 48th St. Pier June 11, 1967 (10:33). See paper file for accompanying material."
1200780,"Jan 1, 1956",RECORDED,1,1,0,Selling a used car in New York City,Tony Schwartz (Sound Recordist),"Trying to sell a car to a used car dealer. Go to several dealers haggling over prices and getting different estimates, different advice. (Total time 17:40). See paper file for accompanying material."
1200829,,RECORDED,1,1,0,"President John F. Kennedy speech, Miami Beach",John F. Kennedy (Speaker),"""John F. Kennedy speech at Miami Beach""--Accompanying collection documentation."
1200987,"Jan 1, 1977",RECORDED,1,1,0,Carousels,Tony Schwartz (Sound Recordist),Central Park carousel (7:08) -- Laughter and soda pouring (:15) -- Laughter and soda pouring (:08) -- Laughter and carousel music (:15) -- Voices at carousel (5:04) -- Carousel music (:33) -- Carousel music (:29) -- Carousel music (:47) -- Carousel music (:45) -- Carousel music (1:01) -- Carousel music and voices (2:01) -- Carousel music and voices (2:22) -- Carousel music and voices (1:44) -- Carousel music and voices (2:48) -- Carousel music and voices (2:36). See paper file for accompanying material.
1201227,"Jan 1, 1960",RECORDED,1,1,0,Children talking,Tony Schwartz (Sound Recordist),"Michael- on ""Amen"" -- Nancy- on medical satellites -song about brothers -on nighttime -on ferry ride -- Raina- on playing in park, dog, country, swim, dinner -- Jonathan- let's go to the hop -- Ann- on being scared -on telescope and astronomy -on going to park -on radio and tv -- Stephen Daily on sidewalk cracks -- Stephen Daily on pretending to ride horseback (Total time 33:02). See paper file for accompanying material."
1201250,"Jan 1, 1960",RECORDED,1,1,0,Children's commercials,Tony Schwartz (Sound Recordist),Montage of children (2:53) -- Scooter (1:58) -- Kids being evicted (1:04) -- Singing voice (Mike) (:36) -- Newspapers (Jeffrey) (1:11) -- Satellite (Steve) (:36) -- Geratol (Steve) (:28). See paper file for accompanying material.
1201938,,,1,1,0,Sounds of crowds,,"Partial contents: 1. City Center lobby after show -- 2. CBS lunchroom -- 3. ""Danny's Hideaway"" men's bar -- 4. Figaro coffee shop (Village) -- 5. Overseas press club luncheon sounds -- 6. Background at cocktail party 7. Piano at cocktail party -- 8. Waiting for Queen Liz at 48th St. and Park Av. -- 9. Audience change at Paris Theater -- 10. Cocktail shaker sounds -- 11. Theater overture music and background -- 12. ""Le Voubray"" background and music -- 13. ""Toffenati"" restaurant background 14. Matinee crowds and police car calls."
1202050,"Jan 1, 1950",RECORDED,1,1,0,Construction sounds #2,Tony Schwartz (Producer),"Partial contents: Construction/4th floor, 435 W. 57th Street -- Construction/4th floor, 435 W. 57th Street -- Blasting shots -- 53rd Street and 6th Avenue -- Power shovel and drilling at 435 W. 57th Street -- Power shovel at 435 W. 57th Street, 1961 -- Tar melting torch -- 53rd Street and 6th Avenue large construction site -- Street drilling/36th Street, 1961 -- Plumber and tool sounds -- Riveting on 55th Street and Madison Avenue, Feb. 1961 -- Pile driver (steam)."
1202054,"Jan 1, 1958",RECORDED,1,1,0,"Country sounds, Elliot, 1958",,Contents: Insects (1:55) -- Insects (2:15) -- Insects (2:27) -- Brook (2:57) -- Insects (4:10) -- Night sound (intro)/rain/thunder/birds/insects (14:15).
1202700,,,1,1,0,"Dalton class, ACS, teenagers",Tony Schwartz (Speaker),Contents: Teenagers and smoking -- Discussing approaches to stop teens and adults from smoking -- Reasons why one started smoking -- Observations of teen smoking -- Defensiveness of smokers.
1202873,,,1,1,0,"Detroit, Walden",,"""Sounds of auto plant in Detroit--guide, stamping, plant, assembly line-- talking to truck driver; Detroit sounds-- unemployment line, comments, guides, union members""--Accompanying collection documentation."
1202878,"Jan 1, 1950",RECORDED,1,1,0,"Dog material, 1950s : reel 1",Tony Schwartz (Speaker),"Contents: 1. Comments in getting a license at the ASPCA -- 2. Wire-haired terrier -- 3. Comments by a veterinarian -- 4. Dog being examined and given shots -- 5. Cab ride home : two cabbies who don't take dogs in their cars -- 6. People's coments about a dog -- 7. Pet shop : the needs of a dog -- 8. Training a dog : a child's comments -- 9. Comments about tail clipping : pros and cons -- 10. Poodle ""exhibit in obedience"" -- 11. Obedience class : one class for poodles and another for all breeds."
1204564,"Jan 1, 1970",RECORDED,1,1,0,Expressions,Tony Schwartz (Speaker),"Dalton school children respond to the question, ""What is an icebox?"""
1205076,"Jan 1, 1982",RECORDED,1,1,0,Pavlova music box,,"1. Pavlova music box (5:45) -- 2. Pavlova music box, edited (:35) -- 3. Pavlova music box and winding (3:00)."
1227196,"Jan 1, 1964",RECORDED,1,1,0,House sounds (inside & out),,"Contents: 1. Washing machine -- 2. Water dripping -- 3. Going from 3K to 5K -- 4. Baking, cutting & eating cake -- 5. Scrubbing sounds -- 6. Squeaky door, 453 W. 56th, 3/1/64 -- 7. Toaster -- 8. Vacuum cleaner -- 9. Washing machine -- 10. Radiator sounds -- 11. Vacuum sounds -- 12. Vacuum sounds -- 13. Vacuum sounds."
1250845,,,1,1,0,Gambling sounds and discussion about the lottery,Phil Ciffer (Speaker),"RXF 9242: Various gambling sounds, including a roulette wheel (6:59). RXF 9243: 1. Roulette wheel (1:17) -- 2. Phil [Ciffer?] and Frog talk about the lottery (1:20)."
1294132,,,1,1,0,Ice skating,,"""Ice Skating Sounds/man selling ice cream/orchestral music to skate to/clapping/sound of the New York Icecapades (26th edition)/sound of skating/spinning, etc.""--Accompanying collection documentation."
1521162,"May 1, 1968",RECORDED,1,1,0,"James Moore, 1968-05 : sound effects",,Contents: 1. Birds/Bells/Thunder (3:40) -- 2. Birds/Thunder (3:55).
1588347,,,1,1,0,Music boxes & toys,,Contents: Various music boxes & toys (2:35) -- Various music boxes & toys (4:30) -- Toys (2:15) -- Demonstration of music boxes at store (13:25) -- More music boxes with woman explaining (8:05).
1589012,"Jan 1, 1972",RECORDED,1,1,0,"Party : birthday & surprise, teenage, 1972-1973",Tony Schwartz (Speaker) | Anton Schwartz (Speaker) | Kayla Schwartz (Speaker) | Natalie Schorr (Speaker),"Contents: Natalie Shorr, 10/27/73 [on leader, but box says 11/27] (1:13) -- Anton birthday party, early party, 6/3/73 (1:04) -- Birthday card for Kayla, 1972 / by Tony & others (:51) -- Another version of #3 (:51) -- Surprise! (:10) -- Ext. to Int. sounds : a motor, then footstep & French (:50) -- Planes (:10) -- Cars passing (:40) -- Birds chirping (:29) -- Somene whistling over birds (:15) -- Car passing (trolley?) (:13) -- Trolley? or train bell (:11) -- Horns, unique (:04) -- French street, caller? (:07) -- Church bells (:22) -- Passing car horns (:15) -- Street caller? (:08) -- Street caller with bell (:10) -- Passing trolley with announcement on PA (:15) -- Announcement in restaurant? (:23) -- Whistle & man announces something (:06) -- Horse cart with bells? (:32) -- Music with whistler & narration in French using above sounds : man & woman narrate : sounds like traveloge (8:44)."
1604671,,,1,1,0,Party sounds,Reenah Schwartz (Speaker) | Tony Schwartz (Speaker),Sounds from birthday parties and an anniversary party.
1631882,"Jan 1, 1964",RECORDED,1,1,0,"Soda pouring and drinking after work, 1960s",Tony Schwartz (Speaker),"Contents: Heavy breathing, pouring, then drinking, and a sigh of relief (:32) -- Repeat of previous segment (:30) -- Tests of the same, some interaction between Tony and actor, burping and laughter ((2:17) -- Money into a vending machine and soda pouring into a cup : repeats twice (:46) -- Motorcycle turns off, money into a vending machine, soda pours into the cup (:21) -- Repeat previous segment (:24) -- Clicking sound, then soda pours (:19) -- Basketball dribbling, opening a soda, pouring it into a glass, some background noises from a gym (:31) -- Basketball dribbling only (:05) -- Basketball dribbling, it stops, opening and pouring of soda, some background noises of an indoor gym (:31) -- Gymnasium sounds and ball playing only (:33)."
1632797,"Jan 1, 1960",RECORDED,1,1,0,"Sound pollution, 1960s",Tony Schwartz (Speaker),"""Tony discusses how there are 2 types of pollution, that which is made by physical particles & that which is made by sound. He then demonstrates by recording 60 seconds of city sound pollution, car horns, drilling, sirens, music, motors, airplanes, bands, trains, dog barking, motorcycle, truck horn""--Accompanying collection documentation."
1830589,"Jan 1, 1967",RECORDED,1,1,0,"Sounds of space #2, circa 1967-1970",,"1.Space sounds made by synthesizer (:59) -- 2. Synthesized string instrument sounds (:25) -- 3. Repeat of segment #2 [two times?] (:49) -- 4. Synthesized horn sounds with melody (:41) -- 5. Synthesized space sounds ending with cymbal, a pause, repeat of electronic sounds (1:27)."
1199965,"Jan 1, 1962",RECORDED,1 - check for music,1,0,Applause at different events and environments,Tony Schwartz (Sound Recordist),"Applause at [Rhinoceros?] -- Philharmonic Hall (people chatting) -- Crowd sounds before [Entre Acte music?] (laughter- final applause) -- [Funny thing happened on the way to the Forum?] -- Ballet (applause) -- Bob Dylan concert (applause) -- [102 in the shade?/ (walking out, selling programs, end applause, cutain, intermission lobby sound)."
1202737,"Jan 1, 1987",RECORDED,1 - check for music,1,0,"CrimeWatch : SFX, 1987",,"Contents: 1. Voice over takes (8:33) -- 2. Voice overs/SFX : glass, screams (3:08) -- 3. Sirens, glass, etc. (:15) -- 4. Voice overs without sound effects (:21) -- 5. Voice overs with sound effects (:17) -- 6. Voice overs with sound effects (:17) -- 7. Voice overs with sound effects (:17) -- 8. Sound effects with music (:45) -- 9. Sound effects : screams, shots, sirens (:17) -- 10. [Seven identical tracks of #9]."
1204165,"Jan 1, 1960",RECORDED,1 - check for music,1,0,Edison phonograph #1,Tony Schwartz (Speaker) | Norman Speeder (Speaker),"Contents: 1. Comments on Edison records, first LP, wax cylinders (15:50) -- 2. Art and science, Speeder discussing work concerning Edison, Edison's history (19:50)."
1204166,"Jan 1, 1960",RECORDED,1 - check for music,1,0,Edison 2,Norman Speeder (Speaker),Contents: 1. Musical introduction for show on Edison without inserts (8:41) -- 2. Norman Speeder remarks (6:00) -- 3. Recordings and comments on recording (5:28) -- 4. Hi-fi test record (3:40).
1204169,,,1 - check for performer,1,0,Edison #4,Thomas A. Edison (Speaker) | Bob Marcado (Speaker) | Tony Schwartz (Speaker),"Contents: 1. Edison phonograph recordings and other recordings (9:13) -- 2. Music recording (2:15) -- 3. Discussion of Edison phonograph, Edison history, recordings (33:16)."
1185382,"Oct 1, 1956",RECORDED,1 - check for recognizable performers,1,0,Scottish bagpipes,,1. Musical opening (0:23) -- 2. Island cradle song and comments (1:19) -- 3. Dance song (0:49).
1588314,,,1 - check for recognizable performers,1,0,Music effects,,"Contents: Slide whistle (:52) -- Piano (3:10) -- Violin practice (1:10) -- Chimes (1:10) -- Piano (1:50) -- Drums (Moondog) (1:55) -- Clarinet, squeals (1:10) -- Orchestra & chimes (3:50) -- Jazz (:60) -- Clarinet (1:15)."
1522280,,,1 - confirm PD,1,0,"Music, Army Band",United States Marine Band (Performer) | United States Army Band (Performer),Contents: 1. Stars & stripes forever (:50) -- 2. Stars & stripes forever (3:15) -- 3. American patrol (4:00).
1593170,,,3 - needs research; may contain copyright music,1,0,"Old record players, cylinders","Billy, singer. Price (Speaker) | Tony Schwartz (Speaker)",Contents: 1. Interview with Bill Price on his Edison phonograph (1:38) -- 2. Cylinder of background info on Rigaletto : excerpt (:28) -- 3. Cylinder of quartet from Rigaletto : excerpt (1:32) -- 4. Fuller version of #1 (3:41) -- 5. Complete cylinder both sides (8:30).
1201237,"Jan 1, 1960",RECORDED,1,2,0,Children on various subjects - to edit,Nancy Schwartz (Speaker) | Tony Schwartz (Sound Recordist),"Riddles- Nancy S. and Howard驴s children (6:39) -- Tracy Sugarman驴s son on boat, tv, living in city (4:55) -- Tracy驴s daughter and Nancy Schwartz- riddles- on brother, books, teachers books, drawings (9:17). See paper file for accompanying material."
1202701,,,1,2,0,Dalton children on biographies,,Contents: Views on music vs. lyrics (5:35) -- Reactions to own biography (1:51) -- Choosing between sound + writing for doing autobiography (5:36).
1204215,"Jan 1, 1950",RECORDED,1,2,0,Electricity,Tony Schwartz (Speaker),Contents: 1. Man discussing advances in electricity from 1900 on (4:57) -- 2. Woman discussing electricity (2:16) -- 3. Con Edison workman in manhole (6:15).
1204669,"Jan 1, 1944",RECORDED,1,2,0,"FDR, election eve R-1, 1944",Franklin D. (Franklin Delano) Roosevelt (Speaker) | Humphrey Bogart (Speaker) | Judy Garland (Speaker),"""Franklin Delano Roosevelt campaigning""--Accompanying collection documentation."
1205045,"May 10, 1968",RECORDED,1,2,0,"Museum of Modern Art tour, 1968-05-10",,1. Squeaky noises (2:00) -- 2. Comments of young New Yorkers about art at the museum (24:00) -- 3. Museum manager discusses rental of art (2:00) -- 4. More comments and opinions (19:15).
1604674,,,1,2,0,Pattern response,Tony Schwartz (Speaker),"Contents: Compilation of various reactions to patterns (:57) -- Man responds to patterns (1:05) -- Woman responds, then another woman, maybe a third (5:12) -- Another man (2:31)."
1839121,"Jan 1, 1964",RECORDED,1,2,0,"Ted Smith, with sounds of microphone testing, seagulls, boats, and",Ted Smith (Speaker),"1. Various remote recordings of sounds, including microphone testing ; seagulls ; sounds on a boat, including starting the motor, water, talking ; 1964 Lincoln Continental ""sound spectrum,"" car sounds with window open and closed, with radio on, etc. (20:00) -- 2. Bird and cricket sounds (2:08)."
1192522,"Jan 1, 1951",RECORDED,1,,0,Cindy & Cathy Roberts : Paul's children,Tony Schwartz (Interviewer),"Children answer questions from Tony Schwartz about parades, birds, songs, a recent operation, and stories they know."
1201113,,,1,,0,Wallace Wohlking - cassettes,"Tony Schwartz (Interviewer) | Wohlking, Wallace (Speaker)","Speaks about memory retention, mnemonic speech, education, and cassettes (Total time 31:57). See paper file for accompanying material."
1201228,"Jan 1, 1960",RECORDED,1,,0,Children - Caren Newman - Susan Barnert,Caren Newman (Speaker) | Susan Barnert (Speaker) | Tony Schwartz (Sound Recordist),"Susan Barnert - fudge fudge -- Peal [Peel?] that orange -- Standing on the corner -- When I was in kindergarden -- general talk -- Fisherman fisherman -- Sally ate a pickle -- Mother I am ill -- Fudge fudge -- Standing on the corner -- Apples, peaches -- My mother, your mother -- 1,2,3,4,5,6,7 -- Blue bells -- Over in the meadow -- Here comes teacher -- Sally ate a pickle -- 1,2,3,4,5,6,7 -- Mother I am ill -- fudge fudge. Caren Newman - The Lord is my shepherd -- Have faith, hope and charity song -- Like a leaf or feather song -- The boweny [bouncy?] song -- The prayer over the ""cholle"" bread -- Talking about dolls, blocks, dresses, about falling -- ""It's nice to play with everybody"" (Total time 16:08). Accompanying file card marks some songs as jump rope versions and some as bouncing ball versions. See card at RXF 7765 in paper file. The cover portion of a make your own valentines kit was found in the tape box. On the back of the cover is a list, written partly with letters and partly with pictographs. Meaning is unknown. Filed under RXF 7765 in paper file. See paper file for accompanying material."
1203608,,,1,,0,"Sheila Turner ""Heads."" Pt. 1, R 1",,"""Comments from drug users about drugs and their effects""--Accompanying collection documentation."
1204249,,,1,,0,Equipment tests,Tony Schwartz (Speaker),"""Testing microphones and tape decks""--Accompanying collection documentation."
1205332,,,1,,0,Fighting- master,,"""Comments on fighting and aggression, war, and boxing""--Accompanying collection documentation."
1208398,,,1,,0,Dick Fisher (Fordham),,Contents: Students talking about teachers (10:15) -- Teachers and students talking about teaching (21:35).
1288816,"Jan 1, 1962",RECORDED,1,,0,"House, 453 W. 56th St., 1962",Tony Schwartz (Interviewer) | Reenah Schwartz (Speaker),"Contents: Mr. Engle discusses closets and shelving with Reenah and Tony Schwartz -- Exterminator talks about poisons used to eliminate tree caterpillars, especially a type mentioned in the book Silent Spring -- Tony interviews a house painter -- Tony talks with carpenters."
1348448,,,1,,0,Ginn oral literacy program,Tony Schwartz (Speaker),"""Description of class material (examples of recorded sound sonomontage of selling) / the psychological effects of sounds (ex. preacher, sports anchor) / the importance of context (ex. numbers with no context, then with context)""--Accompanying collection documentation for RXF 9259. ""How people make sense of sounds in their everyday lives""--Accompanying collection documentation for RXF 9258."
1588771,"May 10, 1952",RECORDED,1,,0,Nancy Schwartz : reel 2,Nancy Schwartz (Speaker),"Ten audio segments of Nancy Schwartz from May 10, 1952 at age three months to May 17, 1954 at age two years and three months."
1604669,,,1,,0,Paris,,Interior and exterior sounds of Paris and sounds from a birthday party.
1632609,"Jul 1, 1974",RECORDED,1,,0,"Sound environments, 1974-07",Tony Schwartz (Speaker) | Anton Schwartz (Speaker) | Reenah Schwartz (Speaker) | Many Zane (Speaker),"""Outdoors in Briarcliff. Many, Tony, Reenah, Anton are all getting out of a car in the country with birds in the background""--Accompanying collection documentation."
1831363,"Dec 24, 1968",RECORDED,1,,0,William Anders's description of the moon from the Apollo 8,William A. Anders (Speaker),"The voice of Apollo 8 lunar module pilot William Anders documents his view of the moon from the spacecraft. Some of the craters are active, and some are larger than others due to asteroids and meteoroids. At the end, all of the crew members read verses about the creation of the heavens and the earth from the Book of Genesis in the Bible."
1199857,,,2,,0,Alignment tape - Vanguard,Tony Schwartz (Speaker),"Box indicates that tape runs for 13:20, and that there is a PS 191- announcement toward the end. Collection papers say there is :60 of silence, but also that Tony Schwartz is the speaker, and the tape is 1:10 in duration. See paper file for accompanying material."
1201224,"Jan 1, 1965",RECORDED,2,,0,"Children, Eddy Arbin talking",Eddy Arben (Speaker) | Jonathan Schwartz (Speaker) | Tony Schwartz (Sound Recordist),"Eddie Arbin - school, how to care for a cat (1:30) -- Boys talking- on fighting, what to be when grown up [Michael?] (1:12) -- Boy talking [Jonathan Schwartz?] (9:04). See paper file for accompanying material."
1202877,,,2,,0,Doctors + communications,Reenah Schwartz (Speaker) | Tony Schwartz (Speaker),"Contents: 1. Comment on calling doctors on days off (6:00) -- 2. Show, communications found phones for medicine (15 ips) (3:02) -- 3. Reenah on asthma medicine (7 1/2 ips) (5:38)."
1203246,,,2,,0,Dick Dresner,Tony Schwartz (Speaker) | Dick Dresner (Speaker),"""Reading particular audiences at exact times""--Accompanying collection documentation."
1203248,,,2,,0,Dick Dresner on research,Dick Dresner (Speaker) | Tony Schwartz (Speaker),Dick Dresner on survey research and the use of media in real estate development.
1204172,,,2,,0,"Education, counter education",Tony Schwartz (Speaker),Contents: 1. Show on businessman and student looking at a kit for re-education (satire) (3:18) -- 2. Repeat of above (3:18) -- 3. Comments on counter-education (3:32) -- 4. Comments on counter-education (3:31) -- 5. Comments on counter-education (3:29).
1205331,"Jan 1, 1980",RECORDED,2,,0,"56th St. #3 : edited interviews, 1980-1981",,"""Excerpts from interviews on crime on W. 56th St.""--Accompanying collection documentation."
1205349,"Jul 8, 1967",RECORDED,2,,0,"Fordham Film Conference : reel #1, 1967-07-08",Tony Schwartz (Speaker) | John M. Culkin (Speaker),"""Tony Schwartz speaking at Fordham Film Conference. This is second presentation that Tony gave at the conference. He talked about his interest in folk music, his neighborhood, commercials, films""--Accompanying collection documentation."
1208389,,,2,,0,Plumber Harry Goldstein describes a family funeral,Harry Goldstein (Speaker),No summary found.
1208392,,RECORDED,2,,0,Color me blue,,"Police program highlighting the murder of New York Police Department officer Cecil Sledge [on January 28, 1980] and police in general."
1219751,,,2,,0,Hollywood on trial #3,,Contents: 1. House Un-American Committee investigation of Hollywood. Hollywood 10 on trial. The black list and its effects (32:50) -- 2. Blank tape (:50).
1226347,"Feb 6, 1971",RECORDED,2,,0,"Hypnotist, 1971-02-06",Ken Heyman (Interviewee) | Ken McFeeley (Interviewee),Interview with Ken McFeeley or Ken Heyman.
1286636,"Jan 1, 1979",RECORDED,2,,0,"On hospital care, 1979",Beatrice Lee (Speaker),"""Roosevelt Hospital Care/woman speaks about the long waits at the hospital for her Dr./Another woman speaks about her sister's experiences with surgery & hospitalization""--Accompanying collection documentation."
1385747,"Feb 24, 1975",RECORDED,2,,0,"Bob Landers, 1975-02-24",Bob Landers (Speaker),"""California Recording Session on Phone""--Accompanying collection documentation. Contents: 1. Bambergers one (3:05) -- 2. Bambergers two (3:10) -- 3. Daily news one (1:40) -- 4. Daily news two (5:15)."
1490028,"Mar 1, 1969",RECORDED,2,,0,"Sid Marine, 1969-03",Sid Marine (Speaker) | Tony Schwartz (Speaker),"""Sid Marine and Tony Schwartz talking about appliances and the first radios. He also talked about the 3 different types of batteries. They also talked about listening to the radio as well as different types of radios""--Accompanying collection documentation."
1490426,"Jan 1, 1981",RECORDED,2,,0,"Buddy Hackett story, 1981-01",Buddy Hackett (Speaker),Buddy Hackett [tells?] story of father and the holdup.
1589071,"Aug 28, 1973",RECORDED,2,,0,"Political presentation narration, 1973-08-24 and 1973-08-28",Tony Schwartz (Speaker),"""Tony lectures on media & politics : segments leadered""--Accompanying collection documentation."
1590228,"Jan 1, 1975",RECORDED,2,,0,Polaroid-John Holmes,Tony Schwartz (Speaker) | John Holmes (Speaker),"1. Woman talks to Tony about her experience with a Polaroid during a trip to Cuba (1:09) -- 2. Communication Journal : Tony hosts show with John Holmes on Polaroid exhibit at I.C.P. : discussion of artists' involvement in Polaroid photography (2:55) -- 3. John Holmes : unedited : discussion on intimacy, less serious, daily news photos, love and play in work, photos tell story (7:12)."
1590470,"Jan 1, 1975",RECORDED,2,,0,Polaroid-Bill Warriner : mid 70s,Tony Schwartz (Speaker),"1. Tony introduces Bill Warriner piece made from outtakes : words, their context, e.g. peach, beach (2:10) -- 2. People comment on Boston Expo with musical underscore, repitition, through editing with Jew's harp underscore (left channel only) (3:25) -- 3. Comments without content (expansion of #1) (1:46)."
1632685,"Jan 14, 1975",RECORDED,2,,0,"Roy Solaski, 1975-01-14",Roy Solaski (Interviewee),"Contents: ""1) The tape was dubbed over, first minute is unrelated to tape -- 2) Interview w/Roy Solaski about the ""model of the earth resources technology satel[l]ite"" made by G.E. with sensitive lens this satel[l]ite travels around the earth detecting resources. Use [i.e. Using] color coded displays, photographs can map territories never mapped before such as tracking flooding, offshore breezes, etc.""--Accompanying collection documentation."
1667514,"Feb 26, 1973",RECORDED,2,,0,"Senate Committee on Commerce, 1973-02-26 : reel 3 of 4",Tony Schwartz (Speaker) | Michael Rowan (Speaker),Tony Schwartz on mnemonics and Mike Rowan on social research.
1942064,"Sep 27, 1971",RECORDED,2,,0,"Comments by Jeanette Prussak and Rod Oshey, 1971-09-27",Tony Schwartz (Speaker) | Rod Oshey (Speaker) | Jeannette Prussak (Speaker),"Rod Oshey comments on how teachers present themselves: doctors practice medicine, lawyers practice law, but teachers teach, they do not practice teaching. Jeanette [Prussak?] comments on her experience at the airport picking up her mother, who came in on El Al Airlines, through customs: the flight was delayed and customs was long, rude, and in violation of personal property."
1182649,,,1 - need to check for recognizable performers,,0,Muse in the mews,Donald McKayle,A string instrument is picked and a horn type instrument is played (oboe?) (22:11).
1192224,"Mar 1, 1953",RECORDED,1 - performer?,,0,Rabbi,,"A Rabbi speaks and sings in Yiddish: speaks briefly about himself in English, speaks about the songs he sings."
1185080,,RECORDED,3 - not enough information,,0,Russian [Baltic Sea?] material,,No summary found.
1193696,,RECORDED,3 - not enough information,,0,"Steel drums ""Lifetime tape""",,1. (0 :25) -- 2. (3:45) -- 3. (3:27).
1201786,"May 29, 1963",RECORDED,3 - not enough information,,0,"Catholic confirmation service for Susan Barnert, 1963-05-29",,No summary found.
