id,date,type,status,priority,digitized,title,contributors,summary
1178070,"Jan 31, 1968",RECORDED,2,,1,"Ted Carpenter guest lecture on language in Marshall McLuhan's class,","Edmund Snow Carpenter (Speaker) | Marshall McLuhan (Speaker) | Tony Schwartz (Sound Recordist) | New Sounds, Inc. (Undetermined)","""Carpenter at Fordham University on language, origins, pre-speech human communication, ritual and language, print culture, mathematics and language, numbers and identity"" (00:00)--Accompanying collection documentation."
1178556,"Aug 1, 1968",RECORDED,2,,1,"Tony Schwartz and Marshall McLuhan, conversation, 1968, August",Tony Schwartz (Producer) | Marshall McLuhan (Speaker),"""McLuhan with Tony on politics, politics as show business, evolution of cities, communism, return to 19th century, identity and environment, JFK and Trudeau as models of the reluctant hero in politics, jazz, etc."" (00:00) --Accompanying collection documentation."
1181535,"Nov 30, 1963",RECORDED,2,,1,Moritz Jagendorf on folklore and wine.,M. A. (Moritz Adolph) Jagendorf (Speaker) | Tony Schwartz (Speaker),"RXF 5023: Tony Schwartz talks to Jagendorf about how he came to collect folklore (00:00) -- Jagendorf tells T.S. stories of wine, wine making and wine drinkning (03:10) -- The sound of pouring wine is recorded (08:57) -- Sophie tells how to make chestnut wine (10:20) -- Jagendorf tells T.S. about: The folklore organizations he's part of, about his books, his techniques for gathering stories, stories his mother told him (11:56) -- How he came to collect folklore (again) (22:02) -- The story of ""Lucky Rose Cabin"" (26:34)."
1192408,"Sep 1, 1952",RECORDED,2,,1,"Moses Soyer, 1952 September",Tony Schwartz (Interviewer) | Moses Soyer (Speaker),"RXF 6838: Moses [Soyer] talks about his paintings, his lifestyle, his artistic training, the sale of his paintings, etc. to Tony [Schwartz] (00:00)."
1195719,,,2,,1,Alan Bleviss,Alan Bleviss (Speaker) | Tony Schwartz (Speaker),"Few takes of Tony instructing Alan of how he would like to have copy read, Alan tries a couple. See paper file for accompanying material."
1200129,"Jan 1, 1967",RECORDED,2,,1,Milt Barnert,Milton Barnert (Speaker),"Reel 1. (3 3/4 IPS) Oral correspondence to family and Schwartz family. Unknown length, no machine to play it on. (00:09) -- Oral correspondence/ speaks of local sights in San Antonio and chronicles his days. Says hello to friends and family. (7.5 IPS) (31:03). Reel 2. Oral correspondence ( background noise from previous recordings) (12:30) -- Milt Barnett and daughter, wife, oral correspondence (14:42). See paper file for accompanying material."
1348524,"Jan 1, 1971",RECORDED,2,,1,Global village 71,Edmund Snow Carpenter (Speaker),Anthropologist Edmund (Ted) Carpenter on pope and African ruler.
1490012,,,2,,1,Bob Marcato & Tony Schwartz discussion on precise speech,Bob Marcato (Speaker) | Tony Schwartz (Speaker),RXG0235: Bob Marcato and Tony Schwartz talking about precise speech (0:0) -- End (2:37).
1604702,"Nov 30, 1966",RECORDED,2,,1,"Post-literacy reading : AT&T, McCann Ericson, 1966-11-30",Kayla Schwartz (Speaker) | Tony Schwartz (Speaker) | Marshall McLuhan (Speaker) | Ben Shahn (Speaker) | Alexander Scourby (Speaker) | Nancy Schwartz (Speaker),Tony's presentation on the relation of sound to reading and writing in the age of post-literacy : excerpts start with Ben Shahn and end with Nancy Schwartz (11:24)[00:00] -- Tony's narration without inserts (timing includes leader) (4:31)[11:25].
1626330,,,2,,1,Massachusetts universities presentation,,No summary found.
1628252,"Nov 26, 1990",RECORDED,2,,1,"Stimuli and response presentation, 1990-11-26",Tony Schwartz,No summary found.
1628645,"Jan 29, 1992",RECORDED,2,,1,"Dalton presentation, 1992-01-29",,"This tape includes an insert for the Media Peace Corps presentation, Feb. 19, 1991."
1629817,"Aug 15, 1988",RECORDED,2,,1,"Sadako and the 1000 paper cranes, scratch track, 1988-08-15",Liv Ullmann (Speaker),"Liv Ullmann, narrator."
1647339,,,2,,1,Checking in for physical training at the Park Health Club,Tony Schwartz (Speaker),Recording of Tony Schwartz checking in for physical training and discussing medical history with physical trainer.
1667558,"Jan 1, 2001",RECORDED,2,,1,Tony Schwartz acceptance speech for the Lifetime Achievement Award,Tony Schwartz (Honoree) | American Association of Political Consultants (Host),Tony Schwartz received the Lifetime Achievement Award from the American Association of Political Consultants in 2001. This recording appears to be dubbed from a prior recording.
1667647,,,2,,1,Test of Dolby B,Tony Schwartz,"""Normal tape on Dolby B"""
1697501,,,2,,1,"Answering machine message, Tony Schwartz collection",,Appears to be an answering machine outgoing message -- includes unidentified man counting upward and a long beep. Recorded on 90 second Sanyo endless tape announcement cassette.
1705891,,,2,,1,Symposium on media; Telephone conversation with Larry,Tony Schwartz (Speaker),"Side A: Tony Schwartz gives a presentation at the second annual Stewart [sp?] Symposium via telephone or satellite. Other guests include Larry Bartel, Bob Stewart. Side B: First: Closing remarks at the end of the symposium. Second: Tony Schwartz calls Larry [?] to arrange for payment."
1727840,"Jan 1, 1993",RECORDED,2,,1,Interview about smoking rooms in hotels; Rough takes of part of an,Tony Schwartz (Speaker),"First: Mr. Sarson Bayef [sp?] talks to Tony Schwartz via interpreter. Says he was invited to the United States to learn about media. Tells Schwartz that he was ill yesterday from staying in a smoking room. Second: Unidentified man reads tag at the end of an ad for county court candidate Daniel Angiolillo to Tony Schwartz several times (""paid for by the committee to elect Daniel Angiolillo county court judge"")."
1806248,,,2,,1,Anton from the pool,Tony Schwartz (Interviewer),Tony Schwartz interviews an unidentified man about his experience moving to the United States.
1806886,"Mar 7, 1983",RECORDED,2,,1,"Paul from pool singing, 1983-03-07",,No summary found.
1809324,"Aug 10, 1998",RECORDED,2,,1,"Ted Smith's global warming comments, 1998-08-10",,No summary found.
1840474,,,2,,1,Tony Schwartz program about the role of the narrator in radio and,Tony Schwartz (Speaker),No summary found.
1200015,"Jan 1, 1962",RECORDED,3 - ad?,,1,Art director's club 1962,Tony Schwartz (Sound Recordist),"Rough tracks for 驴Gold Medal驴 spot/ child humming 驴They put the label on the outside...驴 -- Sound effects/ as follows: train, train station, shush, sirens, laughing, truck, violins, woman talking about canning, children, lion roar, humming (from 驴Gold Medal驴 spot) -- Sound effects/ same as above (duplicate) -- Sound effects/ truck, train, humming (from 驴Gold Medal驴 spot). (Total time approx 12:00). See paper file for accompanying material."
1705735,,,3 - may contain commercial,,1,Conversation about National Victim Center; Conversation about toxicity,Tony Schwartz (Speaker),"Side A: First: Interview with woman from National Crime Victim's Hotline about the negative reaction victims sometimes have to their name -- want to be known as crime victims, not just victims. Parts are taped over. May be material for a commercial. Second: Unidentified man talks with Tony Schwartz about toxicity -- appears to be talking about children's drinks, but the audio is somewhat indistinct. Third: inaudible conversation/speech. Side B: Continuation of inaudible conversation/speech."
1174630,"Jan 24, 1966",BROADCAST,3 - maybe contains performers?,,1,Music and words,Tony Schwartz (Producer) | Reenah Schwartz (Speaker),"RXF 3998: Music and words (Tony Schwartz, narrator ; two unidentified Puerto Rican men, vocals ; unidentified female opera singer, speaker and vocals ; unidentified cab driver, speaker ; Reenah Schwartz, speaker ; unidentified female music teacher, speaker) (0:00)."
1195911,"Jan 1, 1963",RECORDED,3 - might contain ads?,,1,Comments on advertising,Connie Lukian (Interviewer) | Norman Rotholtz (Speaker) | Tony Schwartz (Sound Recordist),"Connie Lukeian, Norman Rotholtz and a taxi driver comment on television advertising / commenting on commercials they like and dislike."
1490321,"Apr 27, 1961",RECORDED,3 - newscast?,,1,"Murray Lerner, 1961-04-27",Murray Lerner (Speaker),"""Master - wedding, events surrounding wedding, newscast""--Accompanying collection documentation."
1174695,"Apr 7, 1970",BROADCAST,3 - not enough information,,1,Hear-sight,Tony Schwartz (Producer) | Dick Olson (Speaker),"RXF 4107: Hear-sight (Tony Schwartz, narrator ; Dick Olson, speaker) (0:00)."
1833603,"Mar 31, 1999",RECORDED,3 - not enough information,,1,"Twelve examples of work recorded by Tony Schwartz, 1999-03-31",Tony Schwartz,No summary found.
1177790,"Jul 6, 1966",BROADCAST,3 - not enough information,,1,"Wednesday review. 1966-07-06, [program about Marshall McLuhan]",Harold Rosenberg (Speaker) | Tom Wolfe (Speaker) | Richard Schickel (Speaker),RXF 4297: Wednesday review 1966-07-06: Harold Rosenberg (00:00) -- Richard (Dick) Schickel (19:07) -- Tom Wolfe (30:25).
1199876,"Dec 1, 1987",,3 - not enough information,,1,Martha Greenhouse voice over demo,Martha Greenhouse (Speaker),Martha Greenhouse (3:36). Cataloger supplied title. See paper file for accompanying material.
1486281,,,3 - not enough information,,1,"Loren, Israel Harmonica",Pauline Loren (Speaker) | Israel Harmonica (Speaker) | Ruthie Wiernie (Speaker),"""Tape segments: Loren, Israel Harmonica, Ruthie Wiernie""--Accompanying collection documentation."
1625972,"Mar 13, 1992",RECORDED,3 - not enough information,,1,"Bandshell radio rough, 1992-03-13",,No summary found.
1626238,"Jun 1, 1983",RECORDED,3 - not enough information,,1,"The Swami on media, 1983-06",Bua (Speaker),No summary found.
1626328,,,3 - not enough information,,1,"Dictation, Solomon R&B",,No summary found.
1627721,"Apr 26, 1983",BROADCAST,3 - not enough information,,1,"WOR : Pegine [sic] Fitgerald and Tony as guest, 1983-04-26",Pegeen Fitzgerald (Speaker) | Tony Schwartz (Speaker),No summary found.
1628264,"Nov 29, 1989",RECORDED,3 - not enough information,,1,"Tony Schwartz, Center for Communications presentation, 1989-11-29",Tony Schwartz (Speaker),No summary found.
1629063,"Feb 17, 1987",RECORDED,3 - not enough information,,1,"Harvard class, 1987-02-17",,No summary found.
1629068,"Feb 13, 1990",RECORDED,3 - not enough information,,1,"Harvard class, with Mike Rowan, 1990-02-13",Michael Rowan,No summary found.
1629739,"Feb 27, 1990",RECORDED,3 - not enough information,,1,"Harvard class, 1990-02-27",,No summary found.
1631386,"Jan 1, 1993",RECORDED,3 - not enough information,,1,I never stayed in the dark long enough (1993 revised version),Manuel D. Zane,No summary found.
1697521,"Oct 22, 1993",RECORDED,3 - not enough information,,1,"Sanitation ticket, 1993-10-22",,No summary found.
1697591,,,3 - not enough information,,1,People for the American way : I have a dream ; A true story,,No summary found.
1705595,,RECORDED,3 - not enough information,,1,"Omega Institute, Ashley Montagu, growing young",Ashley Montagu (Speaker),No summary found.
1719485,"Jul 30, 1982",RECORDED,3 - not enough information,,1,"Bob Landers, Bambergers, 1982-07-30",Bob Landers (Announcer),"""First cassette""--Container."
1719486,"Oct 8, 1982",RECORDED,3 - not enough information,,1,"Bob Landers, Robert Bruce sweaters, Bambergers, Panasonic, 1982-10-08",Bob Landers (Announcer),No summary found.
1806815,,,3 - not enough information,,1,"Kayla's ""best of"" demo tape",,No summary found.
1807100,"Mar 19, 1987",RECORDED,3 - not enough information,,1,"Reenah, Lillian, Tony. 1987-03-19",Tony Schwartz (Speaker),No summary found.
1807594,,,3 - not enough information,,1,"Test tape, Tony Schwartz Collection",,No summary found.
1808050,"Jan 1, 1986",,3 - not enough information,,1,"Manipulation, Pat Farrell, Tony Schwartz collection",,No summary found.
1808519,,,3 - not enough information,,1,"Politics 3, Tony Schwartz Collection",,No summary found.
1808531,,,3 - not enough information,,1,Unidentified Tony Schwartz Collection tape,,No summary found.
1809273,"Jan 1, 1987",PRODUCTION,3 - not enough information,,1,"Richard Kostelanetz, Tony Schwartz as a Horspielmacher. 1987",Richard Kostelanetz,No summary found.
1809517,"Jan 1, 1986",COPYRIGHT,3 - not enough information,,1,Children of war,Jake Holmes,"""Jake Holmes, 1986."""
1809539,,,3 - not enough information,,1,Michaela Schwartz,,No summary found.
1810678,"Mar 18, 1988",RECORDED,3 - not enough information,,1,"B. Smith, ""phantom,"" 1988-03-18",Barbara Smith (Speaker),No summary found.
1811089,"Jan 1, 1995",PRODUCTION,3 - not enough information,,1,"Tony Schwartz program against facism, 1947",Tony Schwartz,No summary found.
1815220,,,3 - not enough information,,1,"No ifs, ands or butts, David Hanlon, Georgetown Day School,",,Lyrics filed with accompanying collection documentation.
1816286,"Nov 14, 1988",RECORDED,3 - not enough information,,1,"Tony Schwartz with Barry Gray, 1988-11-14",Tony Schwartz (Speaker),No summary found.
1816289,,,3 - not enough information,,1,"Sanyo endless loop, Tony Schwartz Collection",,No summary found.
1832912,,,3 - not enough information,,1,Steve Brown interviews Tony Schwartz on American politics and policy,Tony Schwartz (Interviewee) | Steve Brown (Interviewer),No summary found.
1834046,"Jun 1, 1986",RECORDED,3 - not enough information,,1,Tony Schwartz compilation tape,,"Ken McFeeley's permission to use material -- Ken McFeeley & Dr. Kahan on phone, 6/86 -- Gal from pool -- Patrick Reynolds -- Mike Pertschuck -- Dennis Newman, Roosevelt campaign -- William Bloomfield -- Stuart Bainum?."
1834195,"Dec 10, 1949",RECORDED,3 - not enough information,,1,"Human rights celebration, 1949-12-10",,No summary found.
1834350,"Sep 27, 1980",RECORDED,3 - not enough information,,1,"Warren Rudman, button spot comments, 1980-09-27",,No summary found.
1834548,,,3 - not enough information,,1,Tina: a dog's life,,No summary found.
1836294,"Jan 1, 1979",RECORDED,3 - not enough information,,1,"Tony Schwartz background interview, 1979",,No summary found.
2451022,,,3 - not enough information,,1,"The thing, original",,"""The tailor's boy"" with guitar playing (1:05). ."
1712927,"Jan 1, 1961",RECORDED,3 - not enough information but intriguing,,1,"Invisible friends, 1961",,No summary found.
2451858,,,3 - performers?,,1,Italian songs,,Man sings two Sicilian songs. One song about a man who lost a chicken called I lost a chicken and a song about a man who fell in love with 3 sisters (3:13).
1843177,,,3 - potentially contains ads,,1,Tony Schwartz discussing his advertising technique of avoiding,,No summary found.
1809302,,,4 - ads,,1,3 anti-smoking spots: Koop Institute spot ; 2 Janet Sackman spots,Janet Sackman (Speaker),Koop institute spot (:30) -- Janet Sackman spot (1:00) -- Janet Sackman spot (1:00).
1833448,,,4 - ads,,1,Political ads,,No summary found.
1180776,"Jan 1, 1997",PRODUCTION,4 - advertisement,,1,Two Coliseum Books spots from 1997,Tony Schwartz (Sound Recordist),"Two advertisements for Coliseum Books, New York, New York, 1997."
1604599,"Dec 7, 1971",RECORDED,4 - advertisement,,1,"Radio samples, other, 1971-12-07",Tony Schwartz (Producer),"""10 spots from Quigg Lawrence Assoc. w/'original sound'""--Accompanying collection documentation. Commercials for Vepco, Virginia National Bank, and House of Edgewood tobacco read by announcers and actors. 1. Vepco electric heat commercial with a policeman. (00:00) -- 2. Vepco electric heat commercial with a service station owner. (01:07) -- 3. Vepco electric heat commercial with a teacher. (02:13) -- 4. Virginia National Bank commercial with home improvement theme. (03:20) -- 5. Virginia National Bank commercial with camping theme. (04:20) -- 6. Virginia National Bank commercial with boating theme. (05:19) -- 7. Vepco electric heat commercial with home modernization theme. (06:20) -- 8. House of Edgewood tobacco commercial, Ruger rifle comparison. (07:28) -- 9. House of Edgewood tobacco commercial, Martin guitar comparison (08:08) -- 10. Vepco electric heat for baby's room. (08:50)."
1647333,,,4 - advertisement,,1,"Swiss cheese ad, Bruce Morace",,No summary found.
1667987,,,4 - advertisement,,1,Advertisement for Italian jewelry event at Fortunoff,,No summary found.
1705840,,,4 - advertisement,,1,Advertisement for New Sound; Recording test; Telephone presentation,Tony Schwartz (Speaker) | Bob Landers (Speaker),"First: Man (sounds like Bob Landers) reads aloud to Tony Schwartz from a promo for New Sounds, Tony Schwartz's company, from the perspective of Tony Schwartz. Second: recording test. Third: Tony Schwartz talks to Swedish group over the telephone about his successful experience creating commercials for the Association of Independant Colleges and Universities in Massachusetts and about his experiences crafting anti-smoking ads."
1195898,,,4 - commercial,,1,Harry Abrams audition tape,Harry Abrams (Producer),"RXF 7327: Male voices: David Ford , Pan Am (00:00) -- Peter Thomas, (Montage) Exxon, Coca Cola, United Technology (01:05) -- Lester Rawlins, Pepsi, Teem (02:00) -- Bob Landers, Weyerhauser Lumber Company (03:03) -- Scott MacLellan, Pastene olive oil (04:04) -- Tom Bosley, Metropolitan Life Insurance (05:15) -- Jon Lee, (montage) General Electric Corp., Guerlain, Le Bleu Cologne (06:20) -- Bob Maxwell (montage) Bordens, Atrex Herbicide, Commercial Credit Corp. (07:38) -- Stan Martin, Mexico Tourist Board (08:37) -- Ed Green (montage) Bahamas Tourist Organization, Alfa Romeo cars, El Capitan cigars (09:03) -- Mandel Kramer, Cadet wines (10:04) -- Jean Shepherd, Illinois Tool Works (10:39) -- Female Voices: Tammy Grimes, Revlon Mascara (11:38) -- Karen Machon, Jean Nate (12:10) -- Lovelady Powell, Scotchguard Fabric Protector (13:14) -- Audre Johnston, Lifesavers (14:17) -- Lynn Redgrave Masumi Cologne (Coty), Smitty Cologne (Coty) (14:50) -- Annie Kravat, Gossard Bras (15:35) -- Elizabeth Franz, Revlon Moistureizer II (16:19) -- Beverly MacKenzie AT&T Long Lines (16:51)."
1199885,,,4 - commercial,,1,Chuck Blore and Don Richman Incorporated demo tape,,"Stokley-Van Camp - ""Wettin' his pants"" -- Country Legend - ""In the beginning"" -- Michigan Bell - ""A commercial for..."" -- KABC-TV - ""The birds"" -- AT&T - ""Long, long distance"" -- County Seat - ""Lord, have we got jeans"" -- Cleveland Trust - ""The recreation room"" -- O'Neil's Dept. Store - ""For my wife"" -- Miller's beer - ""Finnegan"" -- Rheingold Beer - ""Girls against New York"" -- Hibernia Bank - ""An ego trip"" -- Burgess - ""Stompin' on it"" -- Stern & Mann - ""Cathianne"" -- K-Mart Photo - ""Opposite sex"" -- Texas traffic safety - ""Watch out, Daddy"" (14:00). Cataloger supplied title. See paper file for accompanying material."
1205091,,,4 - commercial,,1,Calls of newspaper vendors,,"RXF 8834: Song of a blind newspaper dealer named Dan (00:00) -- Two newspapers calls (03:00) -- Morning papers call (03:29) -- Pick 'em up here only (04:05) -- Morning paper call, then song from off microphone, then excerpt from a New York Times commercial (05:30) -- Sunday papers call (06:51) -- Morning papers call (08:58)."
1627723,"Jan 1, 1981",RECORDED,4 - commercial?,,1,"American Security Systems, radio spots, 1983-01",,No summary found.
1830518,,,4 - commercial?,,1,Drunk driving PSA's : 4 - 60s,,No summary found.
1181013,"Aug 1, 1989",,4 - contains music,,1,Taxi presentation 1989 August 1,Tony Schwartz (Sound Recordist),"RXF 4954: She's leaving home (John Lennon and Paul McCartney) (dub of this song by The Beatles, with telephone call of a runaway teenage girl mixed in) (00:00) -- story about giving a ride to Jayne Mansfield (unidentified male taxi driver, speaker) (03:36) -- conversation about traffic (Tony Schwartz, interviewer ; unidentified male taxi driver, interviewee) (04:41) -- story about getting lost in the Bronx (unidentified male taxi driver, speaker) (05:38) -- story about a drunken fare (unidentified male taxi driver, speaker) (06:43) -- joke about taking a cab from California to New York (unidentified male taxi driver, speaker) (07:13) -- interview about being held up (Tony Schwartz, interviewer ; unidentified male taxi driver, interviewee) (08:23) -- story about modern art (unidentified man, speaker) (10:28)."
1667613,"Jan 1, 1992",RECORDED,4 - may contain ads,,1,Interview with Tony Schwartz about political commercials,Tony Schwartz (Interviewee),"Begins with a short call by Tony Schwartz to the ""Bill Clinton fact line"" (recording ends when Schwartz is asked for his credit card number). Next: interview with Schwartz (conducted by unidentified woman) about the benefit to the candidate of political advertisements. Schwartz says candidate gains ability to speak to the public, gains control. Interviewer asks about ""false implications,"" which Schwartz responds are ""at least your false implications,"" rather than those just constructed by the media. Also concerns the Daisy ad, which Schwartz calls a Rohrschach test."
1836766,,,4 - music,,1,"Unidentified jazz recordings, Tony Schwartz collection",,No summary found.
1175317,,BROADCAST,4 - performer,,1,Recording in life,Tony Schwartz (Producer) | Jimmy Giuffre (Performer),"RXF 4060: Recording in life (Tony Schwarts, narrator ; Jimmy Giuffre, speaker and clarinet ; unidentified woman, footsteps) (0:00). ""Jimmy Guiffre plays his clarinet against different city sounds and in different environments. Jimmy talks about the thrilling experience of playing in the city. He plays in large office building lobbies. He likes the resonance and the echo.""--Accompanying collection documentation."
1176395,"Jan 1, 1960",COMPILED,4 - performer,,1,Rough material #6,Tony Schwartz (Editor) | Kathleen Walsh (Performer) | Harry Belafonte (Performer) | George Gershwin (Performer) | Leadbelly (Performer) | Herb Levy (Performer) | Frieda Bokwe Matthews (Speaker),"RXF 4261: Learning a language (Tony Schwartz, narrator ; various men and women, speakers) (0:00) -- comments (unidentified child, speaker) (5:01) -- comments (unidentified man, speaker) (5:11) -- comments on treatment received by a foreigner (unidentified man, speaker) (5:19) -- Senzenena (Tony Schwartz, narrator ; mixed chorus, vocals ; unidentified, violin ; Mrs. Frieda Matthews, speaker) (5:40) -- segment comparing Leadbelly and George Gershwin (Tony Schwartz, narrator ; Leadbelly, 12 string guitar and vocals ; George Gershwin, piano) (17:07) -- Relax your mind (Leadbelly, 12 string guitar and vocals) (20:28) -- unidentiifed (George Gershwin, piano) (21:35) -- Eagle rock rag (Leadbelly, piano and vocal) (22:08) -- narration for segment on pennywhistle player Herb Levy (Tony Schwartz, narrator) (24:08) -- unidentified (Herb Levy, pennywhistle, piano, cigar box) (25:21) -- unidentified (Herb Levy, pennywhistle, piano, cigar box) (26:18) -- Jackass will jump and bray (Harry Belafonte, vocals ; unidentified chorus ; Herb Levy, pennywhistle, piano, cigar box) (26:56) -- examples and description of Irish mouth music (Kathleen Walsh, vocals) (29:09) -- examples and description of Hasidic songs without words (unidentified woman, vocals ; unidentified man and woman, vocals) (30:48)."
1178387,"Jan 1, 1960",COMPILED,4 - performer,,1,Rough material,Tony Schwartz (Producer) | Louis Hardin (Performer),"RXF 4708: Story about Jayne Mansfield (unidentified male taxi driver, speaker) (0:00) -- story about pet (unidentified woman, speaker) (1:09) -- discussion of white paint (unidentified man, speaker ; Tony Schwartz, interviewer) (2:06) -- boxer and trainer describe his right hand punch (Rudy Sawyer, speaker ; unidentified man, speaker) (2:47) -- Moondog's San Francisco sounds (Moondog [Louis Hardin], percussion and bells) (4:20) ."
1173089,"Jun 24, 1969",BROADCAST,4 - performer,,1,Folk singers and folks,Tony Schwartz (Producer) | Burl Ives (Performer) | George Edwards (Performer),"RXF 3611: Folk singers and folks (Tony Schwartz, narrator ; Burl Ives, vocal and guitar ; George Edwards, vocal) (0:00). ""With the rise in the popularity of folk concerts, we may ask what a folk singer is and how he differs from a singer of folk songs. Burl Ives, a singer of folk songs, does a studio cut for commercial sale. George Edwards, on his back porch, sings the same song because he likes it, and grew up with it. He is a folk singer""--From collection documentation."
1175407,"Nov 16, 1968",,4 - performer,,1,The alternating current of Sandy Mason,Tony Schwartz (Producer) | Sandy Mason (Performer),"""Styles of singing and presentation change in the course of time. Singers used to walk in with just a guitar, now they bring their own unique electrical equipment. From the Slate Restaurant we hear Sandy Mason talk about work and sing 'Those Were the Days' while playing her guitar. She uses some electronic equipment"" (00:00) --Accompanying collection documentation."
1179204,,RECORDED,4 - performer,,1,African tape,,RXF 4658: All songs untitled. Durations: 1. (1:40)[00:00] -- 2. (0:46)[01:53] -- 3. (1:15)[02:47] -- 4. (1:02)[04:11] -- 5. (2:56)[05:19] -- 6. (1:03)[08:25] -- 7. (1:43)[09:37] -- 8. (1:46)[11:32] -- 9. (2:07)[13:30] -- 10. (2:04)[15:47].
1180148,"Feb 21, 1951",RECORDED,4 - performer,,1,Olga Caweyo 1951 February 21,Tony Schwartz (Producer) | Olga Caweyo (Vocalist/Singer),Argentinian song - boy and mule going uphill (duration 3:40) [time 00:00] -- Street cry of a woman in Baiya - Brazilian (3:44) [3:52] -- Sixteenth century Spanish romance song (2:28) [7:36].
1180196,,,4 - performer,,1,Evelyn Challis,Evelyn Challis (Performer),"The green grass grew all around (00:40) -- One finger, one thumb (6:14) -- If I had a hammer (8:26) -- Under the wild oak tree (11:15) -- Repeat of previous song (12:15) -- Talkin nothin (13:15) -- In a cabin In the woods (15:35) -- Tangalao (18:12) -- Everybody loves saturday night (20:15) -- B-I-N-G-O (23:54) -- Que bonita bandera (26:02) -- The ink is black (28:14) -- Oh won't you sit down (31:54)."
